approved_at_utc,subreddit,selftext,author_fullname,saved,mod_reason_title,gilded,clicked,title,link_flair_richtext,subreddit_name_prefixed,hidden,pwls,link_flair_css_class,downs,thumbnail_height,top_awarded_type,hide_score,name,quarantine,link_flair_text_color,upvote_ratio,author_flair_background_color,subreddit_type,ups,total_awards_received,media_embed,thumbnail_width,author_flair_template_id,is_original_content,user_reports,secure_media,is_reddit_media_domain,is_meta,category,secure_media_embed,link_flair_text,can_mod_post,score,approved_by,is_created_from_ads_ui,author_premium,thumbnail,edited,author_flair_css_class,author_flair_richtext,gildings,content_categories,is_self,mod_note,created,link_flair_type,wls,removed_by_category,banned_by,author_flair_type,domain,allow_live_comments,selftext_html,likes,suggested_sort,banned_at_utc,view_count,archived,no_follow,is_crosspostable,pinned,over_18,all_awardings,awarders,media_only,can_gild,spoiler,locked,author_flair_text,treatment_tags,visited,removed_by,num_reports,distinguished,subreddit_id,author_is_blocked,mod_reason_by,removal_reason,link_flair_background_color,id,is_robot_indexable,report_reasons,author,discussion_type,num_comments,send_replies,whitelist_status,contest_mode,mod_reports,author_patreon_flair,author_flair_text_color,permalink,parent_whitelist_status,stickied,url,subreddit_subscribers,created_utc,num_crossposts,media,is_video,post_hint,url_overridden_by_dest,preview,crosspost_parent_list,crosspost_parent,is_gallery,media_metadata,gallery_data,link_flair_template_id,poll_data,author_cakeday
,Army,"On terminal leave right now and have been applying to some colleges, I’ve seen online that some out of state colleges will allow you to just pay the in state tuition to allow you to pay fully using your GI Bill. Wondering if anyone has done this and if it’s actually a thing cause I’m struggling to find any solid resource on it. Thanks",t2_659yp4ri,False,,0,False,GI BILL OUT OF STATE QUESTION,[],r/army,False,7.0,,0,,,True,t3_18uzzxw,False,dark,1.0,,public,1,0,{},,,False,[],,False,False,,{},,False,1,,False,False,self,False,,[],{},,True,,1703999157.0,text,7.0,,,text,self.army,False,"&lt;!-- SC_OFF --&gt;&lt;div class=""md""&gt;&lt;p&gt;On terminal leave right now and have been applying to some colleges, I’ve seen online that some out of state colleges will allow you to just pay the in state tuition to allow you to pay fully using your GI Bill. Wondering if anyone has done this and if it’s actually a thing cause I’m struggling to find any solid resource on it. Thanks&lt;/p&gt;
&lt;/div&gt;&lt;!-- SC_ON --&gt;",,,,,False,True,True,False,False,[],[],False,False,False,False,,[],False,,,,t5_2qtr8,False,,,,18uzzxw,True,,Full-Task,,0,True,some_ads,False,[],False,,/r/army/comments/18uzzxw/gi_bill_out_of_state_question/,some_ads,False,https://www.reddit.com/r/army/comments/18uzzxw/gi_bill_out_of_state_question/,277270,1703999157.0,0,,False,,,,,,,,,,,
,Army,I don’t know if anyone can help me with this or not but it’s worth a shot! I’m a “PFC” by rank when I got chosen at basic training to be ranked up from pvt2 to PFC. Now this is when the question / story gets funny!! I got ranked up when ippsa was just getting launched so when I got to ait I was still getting paid Pvt2 pay and when I reached out to my leadership about the issue they looked at it and said I had a par just sitting there and that they could not do a thing but resubmit one which they did. Also I had proof that I got ranked up at basic BUT what they did not tell me that is a 1sgt cannot sign the paper for me and my peers to be ranked up. So I just really need some insight on this I’m at ft cavazos now and my leadership swears they are doing what they can to get this resolved but I have not seen a change in my pay. Will I get back pay for this? I’m sorry for such the long post just kinda upsets me.,t2_ql6i44pwg,False,,0,False,Rank Pay Issues,[],r/army,False,7.0,,0,,,False,t3_18uy965,False,dark,1.0,,public,1,0,{},,,False,[],,False,False,,{},,False,1,,False,False,self,False,,[],{},,True,,1703993588.0,text,7.0,,,text,self.army,False,"&lt;!-- SC_OFF --&gt;&lt;div class=""md""&gt;&lt;p&gt;I don’t know if anyone can help me with this or not but it’s worth a shot! I’m a “PFC” by rank when I got chosen at basic training to be ranked up from pvt2 to PFC. Now this is when the question / story gets funny!! I got ranked up when ippsa was just getting launched so when I got to ait I was still getting paid Pvt2 pay and when I reached out to my leadership about the issue they looked at it and said I had a par just sitting there and that they could not do a thing but resubmit one which they did. Also I had proof that I got ranked up at basic BUT what they did not tell me that is a 1sgt cannot sign the paper for me and my peers to be ranked up. So I just really need some insight on this I’m at ft cavazos now and my leadership swears they are doing what they can to get this resolved but I have not seen a change in my pay. Will I get back pay for this? I’m sorry for such the long post just kinda upsets me.&lt;/p&gt;
&lt;/div&gt;&lt;!-- SC_ON --&gt;",,,,,False,True,True,False,False,[],[],False,False,False,False,,[],False,,,,t5_2qtr8,False,,,,18uy965,True,,RealRise1861,,1,True,some_ads,False,[],False,,/r/army/comments/18uy965/rank_pay_issues/,some_ads,False,https://www.reddit.com/r/army/comments/18uy965/rank_pay_issues/,277270,1703993588.0,0,,False,,,,,,,,,,,
,Army,"Any info about 10th Support Group at Torii Station, Okinawa, Japan???",t2_4d6rm7g1,False,,0,False,Question,[],r/army,False,7.0,,0,,,True,t3_18uz53w,False,dark,1.0,,public,1,0,{},,,False,[],,False,False,,{},,False,1,,False,False,self,False,,[],{},,True,,1703996407.0,text,7.0,,,text,self.army,False,"&lt;!-- SC_OFF --&gt;&lt;div class=""md""&gt;&lt;p&gt;Any info about 10th Support Group at Torii Station, Okinawa, Japan???&lt;/p&gt;
&lt;/div&gt;&lt;!-- SC_ON --&gt;",,,,,False,True,True,False,False,[],[],False,False,False,False,,[],False,,,,t5_2qtr8,False,,,,18uz53w,True,,dova01,,3,True,some_ads,False,[],False,,/r/army/comments/18uz53w/question/,some_ads,False,https://www.reddit.com/r/army/comments/18uz53w/question/,277270,1703996407.0,0,,False,,,,,,,,,,,
,Army,"Very specific question, but currently debating whether to stay in and do a long haul to 20 years or to call it quits at 12 years. About to finish my MS in entomology, and considering going AMEDD as a 72B/medical entomologist (currently a musician) and making a shift in my army career.

Is there anyone who is/was/worked with a medical entomologist in the army? Is it generally fulfilling and worth it? Anyone here I can DM or get some info from?

I hear a bunch of negative things about officer burn out and general retention issues but wondering if maybe the 72B/AMEDD route is a bit easier/more chill? Any help would be appreciated, thanks!",t2_79wdxlgn,False,,0,False,"72B, Medical entomologist question",[],r/army,False,7.0,,0,,,True,t3_18uyxs7,False,dark,1.0,#d3d6da,public,1,0,{},,31af83f2-8010-11e4-9de3-22000b268135,False,[],,False,False,,{},,False,1,,False,False,self,False,blank,"[{'e': 'text', 't': '🎺 42R (Musician)'}]",{},,True,,1703995741.0,text,7.0,,,richtext,self.army,False,"&lt;!-- SC_OFF --&gt;&lt;div class=""md""&gt;&lt;p&gt;Very specific question, but currently debating whether to stay in and do a long haul to 20 years or to call it quits at 12 years. About to finish my MS in entomology, and considering going AMEDD as a 72B/medical entomologist (currently a musician) and making a shift in my army career.&lt;/p&gt;

&lt;p&gt;Is there anyone who is/was/worked with a medical entomologist in the army? Is it generally fulfilling and worth it? Anyone here I can DM or get some info from?&lt;/p&gt;

&lt;p&gt;I hear a bunch of negative things about officer burn out and general retention issues but wondering if maybe the 72B/AMEDD route is a bit easier/more chill? Any help would be appreciated, thanks!&lt;/p&gt;
&lt;/div&gt;&lt;!-- SC_ON --&gt;",,,,,False,True,True,False,False,[],[],False,False,False,False,🎺 42R (Musician),[],False,,,,t5_2qtr8,False,,,,18uyxs7,True,,Seameadow321,,1,True,some_ads,False,[],False,dark,/r/army/comments/18uyxs7/72b_medical_entomologist_question/,some_ads,False,https://www.reddit.com/r/army/comments/18uyxs7/72b_medical_entomologist_question/,277270,1703995741.0,0,,False,,,,,,,,,,,
,Army,,t2_8ia2ljgp8,False,,0,False,Which army base has been your favorite so far?,[],r/army,False,7.0,,0,,,True,t3_18uyilj,False,dark,0.89,,public,7,0,{},,,False,[],,False,False,,{},,False,7,,False,False,self,False,,[],{},,True,,1703994421.0,text,7.0,,,text,self.army,False,,,,,,False,False,True,False,False,[],[],False,False,False,False,,[],False,,,,t5_2qtr8,False,,,,18uyilj,True,,goldenguard2,,14,True,some_ads,False,[],False,,/r/army/comments/18uyilj/which_army_base_has_been_your_favorite_so_far/,some_ads,False,https://www.reddit.com/r/army/comments/18uyilj/which_army_base_has_been_your_favorite_so_far/,277270,1703994421.0,0,,False,,,,,,,,,,,
,Army,So recently I was diagnosed by a civilian doctor with ADHD I have been taking medication for 30 days and as of 2 days ago I switched medication due to heart palpitations. I know there is a 90 day no deployment rule while stabilizing on Stimulant Medication. My doctor will not prescribe me with more than a 30 day dose until that 90 day reevaluation. My doctor has written formal letters on my behalf saying I am not stable and I need continuous monitoring. I’ve pushed it up through my chain of command and am getting no info back. All I receive is “thank you for that.” Or “we need this” but no understanding of what to expect. My doctor evaluated me and wrote an additional letter stating my symptoms could be dangerous being that I am an 11B. Heard nothing back. I don’t know what I am supposed to do. I’ve talked to the GI Hotline and received information regarding what next steps I could take and I’ve done some of them but it’s killing me as this deployment creeps closer that I have 0 guidance.,t2_7tuetims,False,,0,False,"National Guard, PreMob coming up. ADHD",[],r/army,False,7.0,,0,,,False,t3_18uw3nv,False,dark,1.0,,public,1,0,{},,,False,[],,False,False,,{},,False,1,,False,False,self,False,,[],{},,True,,1703987175.0,text,7.0,,,text,self.army,False,"&lt;!-- SC_OFF --&gt;&lt;div class=""md""&gt;&lt;p&gt;So recently I was diagnosed by a civilian doctor with ADHD I have been taking medication for 30 days and as of 2 days ago I switched medication due to heart palpitations. I know there is a 90 day no deployment rule while stabilizing on Stimulant Medication. My doctor will not prescribe me with more than a 30 day dose until that 90 day reevaluation. My doctor has written formal letters on my behalf saying I am not stable and I need continuous monitoring. I’ve pushed it up through my chain of command and am getting no info back. All I receive is “thank you for that.” Or “we need this” but no understanding of what to expect. My doctor evaluated me and wrote an additional letter stating my symptoms could be dangerous being that I am an 11B. Heard nothing back. I don’t know what I am supposed to do. I’ve talked to the GI Hotline and received information regarding what next steps I could take and I’ve done some of them but it’s killing me as this deployment creeps closer that I have 0 guidance.&lt;/p&gt;
&lt;/div&gt;&lt;!-- SC_ON --&gt;",,,,,False,True,True,False,False,[],[],False,False,False,False,,[],False,,,,t5_2qtr8,False,,,,18uw3nv,True,,Ecstatic_Sherbet702,,1,True,some_ads,False,[],False,,/r/army/comments/18uw3nv/national_guard_premob_coming_up_adhd/,some_ads,False,https://www.reddit.com/r/army/comments/18uw3nv/national_guard_premob_coming_up_adhd/,277270,1703987175.0,0,,False,,,,,,,,,,,
,Army,I’m at about a 7.,t2_cinyv3o7l,False,,0,False,"On a scale of 1-10, how annoying is it that whenever a thread about the marine corps is made on Reddit, it turns into some variation of “marines attack ground, then army occupies”?",[],r/army,False,7.0,,0,,,False,t3_18uwn0m,False,dark,0.86,,public,82,0,{},,,False,[],,False,False,,{},,False,82,,False,False,self,False,,[],{},,True,,1703988736.0,text,7.0,,,text,self.army,False,"&lt;!-- SC_OFF --&gt;&lt;div class=""md""&gt;&lt;p&gt;I’m at about a 7.&lt;/p&gt;
&lt;/div&gt;&lt;!-- SC_ON --&gt;",,,,,False,False,True,False,False,[],[],False,False,False,False,,[],False,,,,t5_2qtr8,False,,,,18uwn0m,True,,Aggressive-Pay-5670,,70,True,some_ads,False,[],False,,/r/army/comments/18uwn0m/on_a_scale_of_110_how_annoying_is_it_that/,some_ads,False,https://www.reddit.com/r/army/comments/18uwn0m/on_a_scale_of_110_how_annoying_is_it_that/,277270,1703988736.0,0,,False,,,,,,,,,,,
,Army,"I wanna stay AD but I really really want to finish my bachelors I’ve got 2 years or a bit less left to finish but it’s hard to take more than 1-2 classes a semester with my units training schedule I can’t fit in anymore classes plus fields and rotations all the time. I’m a 68W looking to switch my MOS maybe to something else Medical or go be an AGR medic. My ETS is next nov so I can’t start the agr process until around next June according to my retention. I’d like to take 3-4 classes a semester, a pipe dream I know the end goal is to become a PA",t2_nwi96tgk,False,,0,False,College semi-friendly 68 series MOS’s?,[],r/army,False,7.0,,0,,,False,t3_18uw0qy,False,dark,1.0,,public,1,0,{},,,False,[],,False,False,,{},,False,1,,False,False,self,False,,[],{},,True,,1703986946.0,text,7.0,,,text,self.army,False,"&lt;!-- SC_OFF --&gt;&lt;div class=""md""&gt;&lt;p&gt;I wanna stay AD but I really really want to finish my bachelors I’ve got 2 years or a bit less left to finish but it’s hard to take more than 1-2 classes a semester with my units training schedule I can’t fit in anymore classes plus fields and rotations all the time. I’m a 68W looking to switch my MOS maybe to something else Medical or go be an AGR medic. My ETS is next nov so I can’t start the agr process until around next June according to my retention. I’d like to take 3-4 classes a semester, a pipe dream I know the end goal is to become a PA&lt;/p&gt;
&lt;/div&gt;&lt;!-- SC_ON --&gt;",,,,,False,True,True,False,False,[],[],False,False,False,False,,[],False,,,,t5_2qtr8,False,,,,18uw0qy,True,,Princesslia22,,1,True,some_ads,False,[],False,,/r/army/comments/18uw0qy/college_semifriendly_68_series_moss/,some_ads,False,https://www.reddit.com/r/army/comments/18uw0qy/college_semifriendly_68_series_moss/,277270,1703986946.0,0,,False,,,,,,,,,,,
,Army,So I have soldiers that struggle with the 2 mile what are techniques you use when you have tried multiple approaches is it then just not having heart when you have done everything for them,t2_kzao1xxe2,False,,0,False,Soldiers having issues running,[],r/army,False,7.0,,0,,,False,t3_18utaop,False,dark,0.91,,public,9,0,{},,,False,[],,False,False,,{},,False,9,,False,False,self,False,,[],{},,True,,1703979541.0,text,7.0,,,text,self.army,False,"&lt;!-- SC_OFF --&gt;&lt;div class=""md""&gt;&lt;p&gt;So I have soldiers that struggle with the 2 mile what are techniques you use when you have tried multiple approaches is it then just not having heart when you have done everything for them&lt;/p&gt;
&lt;/div&gt;&lt;!-- SC_ON --&gt;",,,,,False,False,True,False,False,[],[],False,False,False,False,,[],False,,,,t5_2qtr8,False,,,,18utaop,True,,Interesting_Access98,,26,True,some_ads,False,[],False,,/r/army/comments/18utaop/soldiers_having_issues_running/,some_ads,False,https://www.reddit.com/r/army/comments/18utaop/soldiers_having_issues_running/,277270,1703979541.0,0,,False,,,,,,,,,,,
,Army,"Are any of them actually useful? Not being sarcastic, wondering if there is any true value on here.",t2_4tjwqtm1,False,,0,False,JKO Courses,[],r/army,False,7.0,,0,,,False,t3_18uvhoe,False,dark,1.0,,public,2,0,{},,,False,[],,False,False,,{},,False,2,,False,False,self,False,,[],{},,True,,1703985462.0,text,7.0,,,text,self.army,False,"&lt;!-- SC_OFF --&gt;&lt;div class=""md""&gt;&lt;p&gt;Are any of them actually useful? Not being sarcastic, wondering if there is any true value on here.&lt;/p&gt;
&lt;/div&gt;&lt;!-- SC_ON --&gt;",,,,,False,False,True,False,False,[],[],False,False,False,False,,[],False,,,,t5_2qtr8,False,,,,18uvhoe,True,,TripotapusRex,,5,True,some_ads,False,[],False,,/r/army/comments/18uvhoe/jko_courses/,some_ads,False,https://www.reddit.com/r/army/comments/18uvhoe/jko_courses/,277270,1703985462.0,0,,False,,,,,,,,,,,
,Army,"Okay so I didn't leave the Army on my owns terms 3 years ago but I've wanted to get back in for awhile now. 

I'm still well below the age limit and I've got an RE-3 code on my DD 214 which means I can normally reenlist but I'm for sure going to need a waiver. With all the recruiting woes I've been hearing about does anyone think there is a chance in hell I could actually get one of those waivers?

I had a 112 GT score and 4 1/2 years in before I made some poor decisions if that means anything. I loved the life but just made one mistake that got me out. I'm not expecting a miracle I just want some kind of clarity.",t2_krc98coqz,False,,0,False,Prior Enlisted with a general under honorable terms discharge looking to try and enlist again.,[],r/army,False,7.0,,0,,,False,t3_18utp09,False,dark,0.64,,public,7,0,{},,,False,[],,False,False,,{},,False,7,,False,False,self,False,,[],{},,True,,1703980606.0,text,7.0,,,text,self.army,False,"&lt;!-- SC_OFF --&gt;&lt;div class=""md""&gt;&lt;p&gt;Okay so I didn&amp;#39;t leave the Army on my owns terms 3 years ago but I&amp;#39;ve wanted to get back in for awhile now. &lt;/p&gt;

&lt;p&gt;I&amp;#39;m still well below the age limit and I&amp;#39;ve got an RE-3 code on my DD 214 which means I can normally reenlist but I&amp;#39;m for sure going to need a waiver. With all the recruiting woes I&amp;#39;ve been hearing about does anyone think there is a chance in hell I could actually get one of those waivers?&lt;/p&gt;

&lt;p&gt;I had a 112 GT score and 4 1/2 years in before I made some poor decisions if that means anything. I loved the life but just made one mistake that got me out. I&amp;#39;m not expecting a miracle I just want some kind of clarity.&lt;/p&gt;
&lt;/div&gt;&lt;!-- SC_ON --&gt;",,,,,False,False,True,False,False,[],[],False,False,False,False,,[],False,,,,t5_2qtr8,False,,,,18utp09,True,,Dagraner4576,,30,True,some_ads,False,[],False,,/r/army/comments/18utp09/prior_enlisted_with_a_general_under_honorable/,some_ads,False,https://www.reddit.com/r/army/comments/18utp09/prior_enlisted_with_a_general_under_honorable/,277270,1703980606.0,0,,False,,,,,,,,,,,
,Army,"Just signed as a 68W and I ship out next month, hoping to get some advice to make sure I’m attached to an infantry unit and not spending the next 6 years as a pair of hands in a base hospital. I’ve been told RASP, but that’s about it, any advice? I want to be Doc.",t2_3m73bzye,False,,0,False,How to ensure I’m a field medic?,[],r/army,False,7.0,,0,,,False,t3_18utgqn,False,dark,0.72,,public,6,0,{},,,False,[],,False,False,,{},,False,6,,False,False,self,False,,[],{},,True,,1703979993.0,text,7.0,,,text,self.army,False,"&lt;!-- SC_OFF --&gt;&lt;div class=""md""&gt;&lt;p&gt;Just signed as a 68W and I ship out next month, hoping to get some advice to make sure I’m attached to an infantry unit and not spending the next 6 years as a pair of hands in a base hospital. I’ve been told RASP, but that’s about it, any advice? I want to be Doc.&lt;/p&gt;
&lt;/div&gt;&lt;!-- SC_ON --&gt;",,,,,False,False,True,False,False,[],[],False,False,False,False,,[],False,,,,t5_2qtr8,False,,,,18utgqn,True,,JacksonSavage331,,17,True,some_ads,False,[],False,,/r/army/comments/18utgqn/how_to_ensure_im_a_field_medic/,some_ads,False,https://www.reddit.com/r/army/comments/18utgqn/how_to_ensure_im_a_field_medic/,277270,1703979993.0,0,,False,,,,,,,,,,,
,Army,Can someone with insight tell me what I should expect or what it’s like? Are the barracks decent? How will I get internet access etc? And I was wondering if I could keep my US number while I’m over there. also if you were over there did you have a gaming console in your barracks?  And overall how being stationed over there is (I leave in 2 days) ,t2_j86azre8,False,,0,False,first duty station in Korea?,[],r/army,False,7.0,,0,,,False,t3_18utdju,False,dark,0.75,,public,2,0,{},,,False,[],,False,False,,{},,False,2,,False,False,self,False,,[],{},,True,,1703979753.0,text,7.0,,,text,self.army,False,"&lt;!-- SC_OFF --&gt;&lt;div class=""md""&gt;&lt;p&gt;Can someone with insight tell me what I should expect or what it’s like? Are the barracks decent? How will I get internet access etc? And I was wondering if I could keep my US number while I’m over there. also if you were over there did you have a gaming console in your barracks?  And overall how being stationed over there is (I leave in 2 days) &lt;/p&gt;
&lt;/div&gt;&lt;!-- SC_ON --&gt;",,,,,False,False,True,False,False,[],[],False,False,False,False,,[],False,,,,t5_2qtr8,False,,,,18utdju,True,,No_Breakfast5348,,37,True,some_ads,False,[],False,,/r/army/comments/18utdju/first_duty_station_in_korea/,some_ads,False,https://www.reddit.com/r/army/comments/18utdju/first_duty_station_in_korea/,277270,1703979753.0,0,,False,,,,,,,,,,,
,Army,Wondering if 26A is also available in the guard or reserve. Did my 25N time and got out and got my CCNP and M.S. in cloud computing,t2_464377fb,False,,0,False,26A in the guard or reserve?,[],r/army,False,7.0,,0,,,False,t3_18utao8,False,dark,1.0,,public,1,0,{},,,False,[],,False,False,,{},,False,1,,False,False,self,False,,[],{},,True,,1703979540.0,text,7.0,,,text,self.army,False,"&lt;!-- SC_OFF --&gt;&lt;div class=""md""&gt;&lt;p&gt;Wondering if 26A is also available in the guard or reserve. Did my 25N time and got out and got my CCNP and M.S. in cloud computing&lt;/p&gt;
&lt;/div&gt;&lt;!-- SC_ON --&gt;",,,,,False,True,True,False,False,[],[],False,False,False,False,,[],False,,,,t5_2qtr8,False,,,,18utao8,True,,FromFrontToRear,,1,True,some_ads,False,[],False,,/r/army/comments/18utao8/26a_in_the_guard_or_reserve/,some_ads,False,https://www.reddit.com/r/army/comments/18utao8/26a_in_the_guard_or_reserve/,277270,1703979540.0,0,,False,,,,,,,,,,,
