,schizophrenia,"It feels amazing. I even slept in until 8 this morning. Risperidone caused me horrible anxiety &amp; insomnia but since switching to Geodon I’ve had none of that. My anxiety is gone, my sleep is improving. I think Geodon might be my drug. The insomnia was awful. Hopefully I can keep up with restful sleep",t2_b38sk7qy3,False,,0,False,Been dealing with insomnia &amp; finally slept the last 2 nights,[],r/schizophrenia,False,,,0,,,False,t3_18uv1ms,False,light,0.67,,public,1,0,{},,,False,[],,False,False,,{},Medication ,False,1,,False,False,,False,,[],{},,True,,1703984239.0,text,,,,text,self.schizophrenia,False,"&lt;!-- SC_OFF --&gt;&lt;div class=""md""&gt;&lt;p&gt;It feels amazing. I even slept in until 8 this morning. Risperidone caused me horrible anxiety &amp;amp; insomnia but since switching to Geodon I’ve had none of that. My anxiety is gone, my sleep is improving. I think Geodon might be my drug. The insomnia was awful. Hopefully I can keep up with restful sleep&lt;/p&gt;
&lt;/div&gt;&lt;!-- SC_ON --&gt;",,,,,False,True,True,False,False,[],[],False,False,False,False,,[],False,,,,t5_2r828,False,,,#2c6336,18uv1ms,True,,Swimming_Fox9090,,3,True,,False,[],False,,/r/schizophrenia/comments/18uv1ms/been_dealing_with_insomnia_finally_slept_the_last/,,False,https://www.reddit.com/r/schizophrenia/comments/18uv1ms/been_dealing_with_insomnia_finally_slept_the_last/,73716,1703984239.0,0,,False,,,,,,,,,429bdcd0-b351-11eb-83e7-0eacb4dbab07,,
,schizophrenia,"After my latest psychotic episode I've decided to create a book that has pages to help people like me develop a care and crisis plan so that way when we become unwell literally anyone can grab this book and know how to help us the way we want to be helped. My only dilemma at the moment is knowing if I should create the book just in print or if I should also offer a digital download of the book that can either be filled out on a tablet/phone or printed out. If I did a digital book it would be less expensive than the print book. I also plan on creating a program where people can ""donate"" a book and those experiencing a financial hardship can apply to receive a donated book. You can see more about the book on my website if it helps. ([jaquelineandjane.com/shop](https://jaquelineandjane.com/shop)) but really I just want to know if I should offer the book in more than one format. Thanks for your help! ",t2_ffwfp2r5,False,,0,False,I need some input!,[],r/schizophrenia,False,,,0,,,False,t3_18uv17k,False,light,1.0,,public,2,0,{},,,False,[],,False,False,,{},Advice / Encouragement,False,2,,False,False,,False,,[],{},,True,,1703984203.0,text,,,,text,self.schizophrenia,False,"&lt;!-- SC_OFF --&gt;&lt;div class=""md""&gt;&lt;p&gt;After my latest psychotic episode I&amp;#39;ve decided to create a book that has pages to help people like me develop a care and crisis plan so that way when we become unwell literally anyone can grab this book and know how to help us the way we want to be helped. My only dilemma at the moment is knowing if I should create the book just in print or if I should also offer a digital download of the book that can either be filled out on a tablet/phone or printed out. If I did a digital book it would be less expensive than the print book. I also plan on creating a program where people can &amp;quot;donate&amp;quot; a book and those experiencing a financial hardship can apply to receive a donated book. You can see more about the book on my website if it helps. (&lt;a href=""https://jaquelineandjane.com/shop""&gt;jaquelineandjane.com/shop&lt;/a&gt;) but really I just want to know if I should offer the book in more than one format. Thanks for your help! &lt;/p&gt;
&lt;/div&gt;&lt;!-- SC_ON --&gt;",,,,,False,False,True,False,False,[],[],False,False,False,False,,[],False,,,,t5_2r828,False,,,#5d7eea,18uv17k,True,,bananna_split,,4,True,,False,[],False,,/r/schizophrenia/comments/18uv17k/i_need_some_input/,,False,https://www.reddit.com/r/schizophrenia/comments/18uv17k/i_need_some_input/,73716,1703984203.0,0,,False,,,,,,,,,467cb704-b34f-11eb-85d3-0ed0dc5434c5,,
,schizophrenia,I just hate these meds they make me not feel like myself,t2_a2g6pt1u,False,,0,False,Has anyone taken a holistic route ?,[],r/schizophrenia,False,,,0,,,False,t3_18uuwll,False,light,0.33,,public,0,0,{},,,False,[],,False,False,,{},Advice / Encouragement,False,0,,False,False,,False,,[],{},,True,,1703983834.0,text,,,,text,self.schizophrenia,False,"&lt;!-- SC_OFF --&gt;&lt;div class=""md""&gt;&lt;p&gt;I just hate these meds they make me not feel like myself&lt;/p&gt;
&lt;/div&gt;&lt;!-- SC_ON --&gt;",,,,,False,True,True,False,False,[],[],False,False,False,False,,[],False,,,,t5_2r828,False,,,#5d7eea,18uuwll,True,,Creative_Abrocoma218,,2,True,,False,[],False,,/r/schizophrenia/comments/18uuwll/has_anyone_taken_a_holistic_route/,,False,https://www.reddit.com/r/schizophrenia/comments/18uuwll/has_anyone_taken_a_holistic_route/,73716,1703983834.0,0,,False,,,,,,,,,467cb704-b34f-11eb-85d3-0ed0dc5434c5,,
,schizophrenia,It’s quite annoying because it drowns nearly every other thought out and I can’t stop it. Just runs it’s course?,t2_hew8hahi8,False,,0,False,Does anyone else hear music playing over and over again in their head for different moods?,[],r/schizophrenia,False,,,0,,,False,t3_18uuhio,False,light,1.0,,public,1,0,{},,,False,[],,False,False,,{},Advice / Encouragement,False,1,,False,False,,False,,[],{},,True,,1703982711.0,text,,,,text,self.schizophrenia,False,"&lt;!-- SC_OFF --&gt;&lt;div class=""md""&gt;&lt;p&gt;It’s quite annoying because it drowns nearly every other thought out and I can’t stop it. Just runs it’s course?&lt;/p&gt;
&lt;/div&gt;&lt;!-- SC_ON --&gt;",,,,,False,True,True,False,False,[],[],False,False,False,False,,[],False,,,,t5_2r828,False,,,#5d7eea,18uuhio,True,,Curious-Pea-8979,,2,True,,False,[],False,,/r/schizophrenia/comments/18uuhio/does_anyone_else_hear_music_playing_over_and_over/,,False,https://www.reddit.com/r/schizophrenia/comments/18uuhio/does_anyone_else_hear_music_playing_over_and_over/,73716,1703982711.0,0,,False,,,,,,,,,467cb704-b34f-11eb-85d3-0ed0dc5434c5,,
,schizophrenia,"Hello, I’m curious if anyone here has had similar experiences to me. I can’t tell if it is stress or something else that could be some sort of pre-symptom of something bigger. I occasionally see (or think I am seeing) people or animals (particularly cats) and I am slowly having more experiences. It doesn’t last long and it is pretty muddy and is normally in the corner of my eye. However, I did have one experience where I thought I saw someone walking across the highway while driving and it caused me to slam on my breaks. My aunt has schizophrenia (only auditory) but it is due to other issues that shouldn’t make it hereditary. I also had one or two experiences when I was younger but I was also bullied pretty badly which may have contributed to it. I have never experienced anything auditory but I am dealing with some other moderate symptoms of stress and depression but those may just be because I am going through a stressful moment. I’m just wondering if anyone else had or knows of someone with something similar. I wish I could reach out to people irl but with the living situation I am in right now I won’t be able to unless I were to do/act insane.",t2_afa59knn,False,,0,False,Has anyone had any similar experiences?,[],r/schizophrenia,False,,,0,,,False,t3_18uu8l1,False,light,1.0,#ffffff,public,1,0,{},,1fbb3e3e-b353-11eb-bc18-0ea6d3b36201,False,[],,False,False,,{},Advice / Encouragement,False,1,,False,False,,False,,[],{},,True,,1703982042.0,text,,,,text,self.schizophrenia,False,"&lt;!-- SC_OFF --&gt;&lt;div class=""md""&gt;&lt;p&gt;Hello, I’m curious if anyone here has had similar experiences to me. I can’t tell if it is stress or something else that could be some sort of pre-symptom of something bigger. I occasionally see (or think I am seeing) people or animals (particularly cats) and I am slowly having more experiences. It doesn’t last long and it is pretty muddy and is normally in the corner of my eye. However, I did have one experience where I thought I saw someone walking across the highway while driving and it caused me to slam on my breaks. My aunt has schizophrenia (only auditory) but it is due to other issues that shouldn’t make it hereditary. I also had one or two experiences when I was younger but I was also bullied pretty badly which may have contributed to it. I have never experienced anything auditory but I am dealing with some other moderate symptoms of stress and depression but those may just be because I am going through a stressful moment. I’m just wondering if anyone else had or knows of someone with something similar. I wish I could reach out to people irl but with the living situation I am in right now I won’t be able to unless I were to do/act insane.&lt;/p&gt;
&lt;/div&gt;&lt;!-- SC_ON --&gt;",,,,,False,True,True,False,False,[],[],False,False,False,False,Undiagnosed ,[],False,,,,t5_2r828,False,,,#5d7eea,18uu8l1,True,,The_WickedHag,,0,True,,False,[],False,dark,/r/schizophrenia/comments/18uu8l1/has_anyone_had_any_similar_experiences/,,False,https://www.reddit.com/r/schizophrenia/comments/18uu8l1/has_anyone_had_any_similar_experiences/,73716,1703982042.0,0,,False,,,,,,,,,467cb704-b34f-11eb-85d3-0ed0dc5434c5,,
,schizophrenia,,t2_lnto9g9ca,False,,0,False,Day 1461 of no irl human interaction,[],r/schizophrenia,False,,,0,,,False,t3_18uthlp,False,light,1.0,,public,3,0,{},,,False,[],,False,False,,{},Trigger Warning,False,3,,False,False,,False,,[],{},,False,,1703980059.0,text,,,,text,self.intrusivethoughts,False,,,,,,False,True,True,False,False,[],[],False,False,False,False,,[],False,,,,t5_2r828,False,,,#ea0027,18uthlp,True,,alicewithaButler,,0,True,,False,[],False,,/r/schizophrenia/comments/18uthlp/day_1461_of_no_irl_human_interaction/,,False,/r/intrusivethoughts/comments/18utdey/day_1461_of_no_irl_human_interaction/,73716,1703980059.0,0,,False,,/r/intrusivethoughts/comments/18utdey/day_1461_of_no_irl_human_interaction/,,"[{'approved_at_utc': None, 'subreddit': 'intrusivethoughts', 'selftext': 'i cut all my hair off , months ago but it’s not growing back .. \n\ni smoke half a pack of cancer sticks a day \n\nthere’s still talk of a solar flare , not sure if that’s real or not but space scares me  .. and we’re all just floating in it .. \n\ni wake up every fucking morning in the mist of a psychosis conversation i’m not even apart of ..\n\nMy diagnosis is BPD &amp; Major depression \n\nMy medication is now officially Latuda it helps for a few hours , their not screaming at me anymore \n\nThere’s a looming possibility of being into racism (both white / and black )  just bc the said group won’t like the people who drove me indoors , even tho i am of color myself , so what they hate me right, they hate them as well .. \n\nI deleted all my socials again / but then i started them over .. fucking exhausting \n\nI got ghosted by a guy who showed me their whole a** hole on video and was calling me daddy .. definitely my soulmate \n\nI can’t eat food anymore , it’s getting pointless because it feels like when you eat in a dream ..\n \nI went outside , terrified and it was cold and disgusting..\n \ni don’t remember what peoples voices sound like besides the ones in my mind … \n\nThe faces of people on the internet are scared into my mind as a forever comparison i’ll never live too \n\nmy internal dialogue reminds me everyone else is outdoors and living life as cute little scene people and i’m inside fighting air … still .', 'author_fullname': 't2_lnto9g9ca', 'saved': False, 'mod_reason_title': None, 'gilded': 0, 'clicked': False, 'title': 'Day 1461 of no irl human interaction', 'link_flair_richtext': [], 'subreddit_name_prefixed': 'r/intrusivethoughts', 'hidden': False, 'pwls': None, 'link_flair_css_class': None, 'downs': 0, 'top_awarded_type': None, 'hide_score': False, 'name': 't3_18utdey', 'quarantine': False, 'link_flair_text_color': 'dark', 'upvote_ratio': 0.87, 'author_flair_background_color': None, 'subreddit_type': 'public', 'ups': 6, 'total_awards_received': 0, 'media_embed': {}, 'author_flair_template_id': None, 'is_original_content': False, 'user_reports': [], 'secure_media': None, 'is_reddit_media_domain': False, 'is_meta': False, 'category': None, 'secure_media_embed': {}, 'link_flair_text': None, 'can_mod_post': False, 'score': 6, 'approved_by': None, 'is_created_from_ads_ui': False, 'author_premium': False, 'thumbnail': '', 'edited': False, 'author_flair_css_class': None, 'author_flair_richtext': [], 'gildings': {}, 'content_categories': None, 'is_self': True, 'mod_note': None, 'created': 1703979741.0, 'link_flair_type': 'text', 'wls': None, 'removed_by_category': None, 'banned_by': None, 'author_flair_type': 'text', 'domain': 'self.intrusivethoughts', 'allow_live_comments': False, 'selftext_html': '&lt;!-- SC_OFF --&gt;&lt;div class=""md""&gt;&lt;p&gt;i cut all my hair off , months ago but it’s not growing back .. &lt;/p&gt;\n\n&lt;p&gt;i smoke half a pack of cancer sticks a day &lt;/p&gt;\n\n&lt;p&gt;there’s still talk of a solar flare , not sure if that’s real or not but space scares me  .. and we’re all just floating in it .. &lt;/p&gt;\n\n&lt;p&gt;i wake up every fucking morning in the mist of a psychosis conversation i’m not even apart of ..&lt;/p&gt;\n\n&lt;p&gt;My diagnosis is BPD &amp;amp; Major depression &lt;/p&gt;\n\n&lt;p&gt;My medication is now officially Latuda it helps for a few hours , their not screaming at me anymore &lt;/p&gt;\n\n&lt;p&gt;There’s a looming possibility of being into racism (both white / and black )  just bc the said group won’t like the people who drove me indoors , even tho i am of color myself , so what they hate me right, they hate them as well .. &lt;/p&gt;\n\n&lt;p&gt;I deleted all my socials again / but then i started them over .. fucking exhausting &lt;/p&gt;\n\n&lt;p&gt;I got ghosted by a guy who showed me their whole a** hole on video and was calling me daddy .. definitely my soulmate &lt;/p&gt;\n\n&lt;p&gt;I can’t eat food anymore , it’s getting pointless because it feels like when you eat in a dream ..&lt;/p&gt;\n\n&lt;p&gt;I went outside , terrified and it was cold and disgusting..&lt;/p&gt;\n\n&lt;p&gt;i don’t remember what peoples voices sound like besides the ones in my mind … &lt;/p&gt;\n\n&lt;p&gt;The faces of people on the internet are scared into my mind as a forever comparison i’ll never live too &lt;/p&gt;\n\n&lt;p&gt;my internal dialogue reminds me everyone else is outdoors and living life as cute little scene people and i’m inside fighting air … still .&lt;/p&gt;\n&lt;/div&gt;&lt;!-- SC_ON --&gt;', 'likes': None, 'suggested_sort': None, 'banned_at_utc': None, 'view_count': None, 'archived': False, 'no_follow': False, 'is_crosspostable': True, 'pinned': False, 'over_18': False, 'all_awardings': [], 'awarders': [], 'media_only': False, 'can_gild': False, 'spoiler': False, 'locked': False, 'author_flair_text': None, 'treatment_tags': [], 'visited': False, 'removed_by': None, 'num_reports': None, 'distinguished': None, 'subreddit_id': 't5_2tqd6', 'author_is_blocked': False, 'mod_reason_by': None, 'removal_reason': None, 'link_flair_background_color': '', 'id': '18utdey', 'is_robot_indexable': True, 'report_reasons': None, 'author': 'alicewithaButler', 'discussion_type': None, 'num_comments': 2, 'send_replies': True, 'whitelist_status': None, 'contest_mode': False, 'mod_reports': [], 'author_patreon_flair': False, 'author_flair_text_color': None, 'permalink': '/r/intrusivethoughts/comments/18utdey/day_1461_of_no_irl_human_interaction/', 'parent_whitelist_status': None, 'stickied': False, 'url': 'https://www.reddit.com/r/intrusivethoughts/comments/18utdey/day_1461_of_no_irl_human_interaction/', 'subreddit_subscribers': 100390, 'created_utc': 1703979741.0, 'num_crossposts': 1, 'media': None, 'is_video': False}]",t3_18utdey,,,,189cc42e-b34e-11eb-9bbd-0eaf23a01099,,
,schizophrenia,,t2_a48yie5n,False,,0,False,"I used to photograph abandoned places before my first episode, including this power plant at a large psychiatric hospital. It's strange to think I would have been a permanent resident here back in the day. Thankful for modern meds and thinking about picking up photography again.",[],r/schizophrenia,False,,,0,,,False,t3_18usqzd,False,light,1.0,#349e48,public,73,0,{},,eb01fe44-b36b-11eb-889e-0eb3444e34d7,False,[],,True,False,,{},Art,False,73,,False,False,,False,,[],{},,False,,1703978110.0,text,,,,text,i.redd.it,False,,,,,,False,False,True,False,False,[],[],False,False,False,False,Schizoaffective (Bipolar),[],False,,,,t5_2r828,False,,,#005ba1,18usqzd,True,,scaredferal,,8,True,,False,[],False,light,/r/schizophrenia/comments/18usqzd/i_used_to_photograph_abandoned_places_before_my/,,False,https://i.redd.it/cvigs3wrli9c1.jpeg,73716,1703978110.0,0,,False,,https://i.redd.it/cvigs3wrli9c1.jpeg,,,,,,,376816ae-b350-11eb-adc6-0e0d3bd20d2f,,
,schizophrenia,"I was diagnosed ADHD at about age 7, and that started little over a decade of my parents punting me between about ~50 mental health professionals (therapists and psychologists) while literally everyone ignored signs there was something more going on.

Apparently, I got tested for autism when I was 16, though nobody ever told me what was happening, I was ignorant until like 20. I'm realizing now it was schizophrenia, not autism, especially with the way I suddenly ""became autistic"" in my teens. But the thing is, I had potential symptoms even earlier. 

For people who developed schizophrenia before they turned 16, what was it like? Anything notable? Especially if it wasn't psychosis; I can't remember any psychosis before I turned 18, when my life started getting better and my memory stopped being blocked. I can't trust my memory of no psychosis before 18, so... what are yalls experiences?",t2_80dhtkz,False,,0,False,But how early did it start? (childhood schizophrenia questions),[],r/schizophrenia,False,,,0,,,False,t3_18urqum,False,light,1.0,#0dd3bb,public,3,0,{},,cc4fb44c-b658-11eb-8a8b-0e5d4c19d3b3,False,[],,False,False,,{},Opinion / Thought / Idea / Discussion ,False,3,,False,False,,False,,[],{},,True,,1703975525.0,text,,,,text,self.schizophrenia,False,"&lt;!-- SC_OFF --&gt;&lt;div class=""md""&gt;&lt;p&gt;I was diagnosed ADHD at about age 7, and that started little over a decade of my parents punting me between about ~50 mental health professionals (therapists and psychologists) while literally everyone ignored signs there was something more going on.&lt;/p&gt;

&lt;p&gt;Apparently, I got tested for autism when I was 16, though nobody ever told me what was happening, I was ignorant until like 20. I&amp;#39;m realizing now it was schizophrenia, not autism, especially with the way I suddenly &amp;quot;became autistic&amp;quot; in my teens. But the thing is, I had potential symptoms even earlier. &lt;/p&gt;

&lt;p&gt;For people who developed schizophrenia before they turned 16, what was it like? Anything notable? Especially if it wasn&amp;#39;t psychosis; I can&amp;#39;t remember any psychosis before I turned 18, when my life started getting better and my memory stopped being blocked. I can&amp;#39;t trust my memory of no psychosis before 18, so... what are yalls experiences?&lt;/p&gt;
&lt;/div&gt;&lt;!-- SC_ON --&gt;",,,,,False,False,True,False,False,[],[],False,False,False,False,Schizophrenia,[],False,,,,t5_2r828,False,,,#0266b3,18urqum,True,,w00tdude9000,,4,True,,False,[],False,light,/r/schizophrenia/comments/18urqum/but_how_early_did_it_start_childhood/,,False,https://www.reddit.com/r/schizophrenia/comments/18urqum/but_how_early_did_it_start_childhood/,73716,1703975525.0,0,,False,,,,,,,,,de51fc7e-b34f-11eb-8843-0e7ee5dad4c7,,
,schizophrenia,"Hello, I’m a woman and I’m 21. For 5 years I have been suffering from deep depression with breaks for episodes of euphoria and mania. I won the fight against drug addiction. I have been taking medication from a psychiatrist for many years. Recently I felt worse, without any sense of joy in my life, without emotion, without desire to live. Yesterday I experienced something strange. While on a walk with my dog (I live in the countryside in the mountains) I saw something black in the corner of my eye that was flying (the shape of the bird). And at the same time I heard the voice of the man right next to my ear, saying a word quickly, and then the beat of my heart - clearly heard in my head, very realistic. At this moment I felt bad and didn't know that I could really hear these voices, whether it was happening or not. It lasted a while and disappeared. Then I heard single sounds, hard to identify - in the back of my head. What do you think ? 

Thanks.",t2_nrpnshhsc,False,,0,False,First symptoms of schizophrenia ?,[],r/schizophrenia,False,,,0,,,False,t3_18urnaw,False,dark,1.0,,public,4,0,{},,,False,[],,False,False,,{},Undiagnosed Questions,False,4,,False,False,,False,,[],{},,True,,1703975279.0,text,,,,text,self.schizophrenia,False,"&lt;!-- SC_OFF --&gt;&lt;div class=""md""&gt;&lt;p&gt;Hello, I’m a woman and I’m 21. For 5 years I have been suffering from deep depression with breaks for episodes of euphoria and mania. I won the fight against drug addiction. I have been taking medication from a psychiatrist for many years. Recently I felt worse, without any sense of joy in my life, without emotion, without desire to live. Yesterday I experienced something strange. While on a walk with my dog (I live in the countryside in the mountains) I saw something black in the corner of my eye that was flying (the shape of the bird). And at the same time I heard the voice of the man right next to my ear, saying a word quickly, and then the beat of my heart - clearly heard in my head, very realistic. At this moment I felt bad and didn&amp;#39;t know that I could really hear these voices, whether it was happening or not. It lasted a while and disappeared. Then I heard single sounds, hard to identify - in the back of my head. What do you think ? &lt;/p&gt;

&lt;p&gt;Thanks.&lt;/p&gt;
&lt;/div&gt;&lt;!-- SC_ON --&gt;",,,,,False,False,True,False,False,[],[],False,False,False,False,,[],False,,,,t5_2r828,False,,,#ffffff,18urnaw,True,,reader023,,2,True,,False,[],False,,/r/schizophrenia/comments/18urnaw/first_symptoms_of_schizophrenia/,,False,https://www.reddit.com/r/schizophrenia/comments/18urnaw/first_symptoms_of_schizophrenia/,73716,1703975279.0,0,,False,,,,,,,,,dccd2c58-b34e-11eb-ae5b-0e48f7f519b5,,
,schizophrenia,^,t2_cf676c2o,False,,0,False,Can your mind trick you into thinking you’re in psychosis,[],r/schizophrenia,False,,,0,,,False,t3_18ur7gq,False,dark,1.0,,public,3,0,{},,,False,[],,False,False,,{},Undiagnosed Questions,False,3,,False,False,,False,,[],{},,True,,1703974178.0,text,,,,text,self.schizophrenia,False,"&lt;!-- SC_OFF --&gt;&lt;div class=""md""&gt;&lt;p&gt;^&lt;/p&gt;
&lt;/div&gt;&lt;!-- SC_ON --&gt;",,,,,False,False,True,False,False,[],[],False,False,False,False,,[],False,,,,t5_2r828,False,,,#ffffff,18ur7gq,True,,RobinIncel,,4,True,,False,[],False,,/r/schizophrenia/comments/18ur7gq/can_your_mind_trick_you_into_thinking_youre_in/,,False,https://www.reddit.com/r/schizophrenia/comments/18ur7gq/can_your_mind_trick_you_into_thinking_youre_in/,73716,1703974178.0,0,,False,,,,,,,,,dccd2c58-b34e-11eb-ae5b-0e48f7f519b5,,
